{
  "schema_version": 1,
  "schema_uri": "https://rsasaki0109.github.io/lidar_slam_ros2/schemas/issue-triage-proposal-v1.schema.json",
  "repository": "rsasaki0109/lidar_slam_ros2",
  "captured_at": "2026-08-10T23:56:43Z",
  "source": {
    "method": "github-rest-read-only",
    "scope": "open-issues",
    "issue_count": 29
  },
  "label_catalog": [
    "bug",
    "documentation",
    "duplicate",
    "enhancement",
    "good first issue",
    "help wanted",
    "invalid",
    "question",
    "wontfix"
  ],
  "authority": {
    "github_writes_authorized": false,
    "proposal_applied": false,
    "authorization_reference": null,
    "remote_mutations_performed": false
  },
  "summary": {
    "issue_count": 29,
    "current_unlabeled": 16,
    "current_good_first_issue": 1,
    "themes": {
      "advanced-scope": 3,
      "install-dependency": 3,
      "quality-reliability": 7,
      "sensor-platform": 9,
      "tf-input-output": 6,
      "validation-community": 1
    },
    "priorities": {
      "P1": 2,
      "P2": 4,
      "P3": 23
    },
    "decisions": {
      "close-answered": 12,
      "close-not-planned": 1,
      "close-resolved": 7,
      "close-superseded": 3,
      "keep-open": 2,
      "request-current-reproduction": 4
    }
  },
  "privacy": {
    "author_identities_written": false,
    "comment_bodies_written": false,
    "issue_bodies_written": false
  },
  "issues": [
    {
      "issue_number": 30,
      "title": "Expected Performance with Ideal Pose",
      "url": "https://github.com/rsasaki0109/lidar_slam_ros2/issues/30",
      "observed": {
        "state": "open",
        "updated_at": "2023-12-03T02:49:02Z",
        "labels": [
          "enhancement"
        ]
      },
      "theme": "quality-reliability",
      "priority": "P3",
      "proposed_labels": [
        "documentation",
        "enhancement"
      ],
      "decision": "close-resolved",
      "state_reason": "completed",
      "apply_after": [],
      "recheck_before_apply": true,
      "rationale": "The current public implementation exposes odom_prior_weight for the frontend and translation-only, covariance-aware GNSS constraints in the backend. Those capabilities postdate this 2021 request and cover its requested weighting path.",
      "response_summary": "Link the current odometry-prior and GNSS workflow, then ask for a new supported-version report only if that documented path fails.",
      "evidence": [
        "docs/workflows.md",
        "scanmatcher/src/scanmatcher_component.cpp"
      ]
    },
    {
      "issue_number": 53,
      "title": "Max distance (km) for mapping ",
      "url": "https://github.com/rsasaki0109/lidar_slam_ros2/issues/53",
      "observed": {
        "state": "open",
        "updated_at": "2023-08-23T08:50:58Z",
        "labels": [
          "question"
        ]
      },
      "theme": "quality-reliability",
      "priority": "P3",
      "proposed_labels": [
        "documentation",
        "question"
      ],
      "decision": "close-superseded",
      "state_reason": "completed",
      "apply_after": [],
      "recheck_before_apply": true,
      "rationale": "This 2022 long-route report used an old configuration and has no current reproducible run contract. Current soak, bounded-disk, and diagnosis workflows supersede the open-ended hardware discussion while retaining long-run limits.",
      "response_summary": "Point to the current soak and diagnosis workflow, state that route length has no single YAML limit, and request a new current-version report with bounded evidence if failure remains.",
      "evidence": [
        "docs/operational-reliability.md",
        "docs/workflows.md"
      ]
    },
    {
      "issue_number": 64,
      "title": "Transform lookup extrapolation warning",
      "url": "https://github.com/rsasaki0109/lidar_slam_ros2/issues/64",
      "observed": {
        "state": "open",
        "updated_at": "2024-09-02T02:47:55Z",
        "labels": [
          "question"
        ]
      },
      "theme": "tf-input-output",
      "priority": "P2",
      "proposed_labels": [
        "bug",
        "question"
      ],
      "decision": "request-current-reproduction",
      "state_reason": null,
      "apply_after": [],
      "recheck_before_apply": true,
      "rationale": "The original report used a Galactic port, but current scanmatcher still performs a timestamp-exact odom TF lookup without a configurable wait. A supported Humble or Jazzy reproduction is needed before choosing timeout, fallback, or rate-limited logging behavior.",
      "response_summary": "Request an exact current revision, PointCloud2 and odom TF timestamps, tf2_echo output, rates, and the smallest reproducible bag metadata; recheck after 30 days.",
      "evidence": [
        "scanmatcher/src/scanmatcher_component.cpp",
        "docs/workflows.md"
      ]
    },
    {
      "issue_number": 69,
      "title": "scanmatcher_node-1 process has died",
      "url": "https://github.com/rsasaki0109/lidar_slam_ros2/issues/69",
      "observed": {
        "state": "open",
        "updated_at": "2024-11-15T03:58:37Z",
        "labels": [
          "bug"
        ]
      },
      "theme": "quality-reliability",
      "priority": "P1",
      "proposed_labels": [
        "bug",
        "help wanted"
      ],
      "decision": "keep-open",
      "state_reason": null,
      "apply_after": [],
      "recheck_before_apply": true,
      "linked_claims": [
        {
          "id": "issue-69-public-draft",
          "kind": "product-draft",
          "repository": "rsasaki0109/lidar_slam_ros2",
          "pull_request": 427,
          "expected_head_sha": "4b2ab514a4f33b443e2c4283b3114d11a5e44e49",
          "expected_status": "DRAFT_REVIEW_REQUIRED",
          "expected_state": "OPEN",
          "expected_is_draft": true,
          "expected_mergeable": true,
          "expected_passing_check_count": 10,
          "expected_skipped_check_count": 4,
          "expected_pending_check_count": 0,
          "expected_failing_check_count": 0,
          "expected_required_checks_complete": true
        },
        {
          "id": "issue-69-stable-release-absence",
          "kind": "stable-release-absence",
          "repository": "rsasaki0109/lidar_slam_ros2",
          "fix_commit_sha": "a2368c486fc35c0edcac6d9dbf2f9cb89475c820",
          "expected_latest_stable_tag": "v0.9.0",
          "expected_latest_stable_commit": "0df0c4a86df9f68a894c83f8342e4107c3d23b0f",
          "expected_latest_stable_relation": "behind",
          "expected_latest_stable_behind_by": 52,
          "expected_candidate_tag": "v0.9.1",
          "expected_candidate_tag_present": false,
          "expected_candidate_release_present": false
        }
      ],
      "rationale": "We traced this failure class to PCL's VoxelGrid overflow behavior: when coordinate extent and leaf size require more than signed-32-bit voxel indices, PCL returns the unfiltered cloud; issue #69 recorded a subsequent SIGFPE. We reproduced the warning class with privacy-safe synthetic points, not the unavailable historical bag. As of 2026-08-17, public Draft PR #427 checks all five classic scanmatcher VoxelGrid stages before PCL, rejects only the affected scan or map update, and passes Humble and Jazzy CI. No named stable release contains this reviewed fix commit yet.",
      "response_summary": "We will keep this open until the fix is merged and a release containing it is named. On current releases, first check that coordinates are metres and remove extreme outliers. Increasing `vg_size_for_map` (initial map/map updates) or `vg_size_for_input` (input scans/non-NDT targets) can avoid the overflow when acceptable, but reduces map/detail resolution and is only a workaround. If testing Draft PR #427, report the ROS distribution, sensor, stage/reason code, and whether the same process accepts the next safe scan; the original 2 GB bag is not required.",
      "evidence": [
        "scanmatcher/src/scanmatcher_component.cpp",
        "scanmatcher/include/scanmatcher/voxel_grid_safety.hpp",
        "scanmatcher/test/test_voxel_grid_safety.cpp",
        "scanmatcher/test/test_scanmatcher_voxel_grid_recovery.cpp",
        "docs/operational-reliability.md",
        "docs/evidence/voxel-grid-overflow-safety-2026-08-11.md"
      ]
    },
    {
      "issue_number": 83,
      "title": "About the use in the window environment",
      "url": "https://github.com/rsasaki0109/lidar_slam_ros2/issues/83",
      "observed": {
        "state": "open",
        "updated_at": "2024-02-26T02:46:47Z",
        "labels": [
          "question"
        ]
      },
      "theme": "sensor-platform",
      "priority": "P3",
      "proposed_labels": [
        "question"
      ],
      "decision": "close-answered",
      "state_reason": "completed",
      "apply_after": [],
      "recheck_before_apply": true,
      "rationale": "Native Windows is outside the maintained product contract, and the reporter explicitly chose Docker. The current Docker first-map route is the supported answer.",
      "response_summary": "Link the Docker first-map path and the Windows support boundary; invite a new report only for a reproducible failure on the supported container route.",
      "evidence": [
        "SUPPORT.md",
        "docs/getting-started.md",
        "docs/product-contract.md"
      ]
    },
    {
      "issue_number": 89,
      "title": "Perfomance in real time drone systems ",
      "url": "https://github.com/rsasaki0109/lidar_slam_ros2/issues/89",
      "observed": {
        "state": "open",
        "updated_at": "2024-06-28T19:20:10Z",
        "labels": [
          "question"
        ]
      },
      "theme": "sensor-platform",
      "priority": "P3",
      "proposed_labels": [
        "documentation",
        "question"
      ],
      "decision": "close-resolved",
      "state_reason": "completed",
      "apply_after": [],
      "recheck_before_apply": true,